{
    "name":"Shao-Man Lee",
    "photo": "Leaderprofile.PNG",
    "region":[
        "AI and Law",
        "Legal Text Mining",
        "Cultural Study of Law",
        "Constitutional Law"
    ],
    "position":"NCKU Miin Wu School of Computing Associate Professor",
    "motto":"Work hard, play hard",
    "tel":"+886 2757575 #80980",
    "e-mail":"shaomanlee@gs.ncku.edu.tw",
    "bio":"Shao-Man Lee is Associate Professor at the Miin Wu School of Computing at National Cheng Kung University (NCKU), with a joint appointment in the Department of Psychology. Shao-Man’s research focuses on developing culturally fair legal AI systems, computational approaches to legal analysis, and governance frameworks for responsible AI development. Shao-Man serves as Executive Secretary of the International Society of Public Law Taiwan Chapter and as an advisor to the Taiwan Bar Association’s AI Development and Response Committee. She recently led the Ministry of Justice’s Prosecutorial AI Assistance System project. Shao-Man graduated from National Taiwan University College of Law and obtained her LL.M. from Yale Law School and her J.S.D. from the University of California, Berkeley."
}